{
  "schema_version": 1,
  "backup_id": "00000000-0000-4000-8000-000000000001",
  "archive_file": "archive.tar.zst",
  "archive_sha256": "0000000000000000000000000000000000000000000000000000000000000000",
  "manifest_sha256": "0000000000000000000000000000000000000000000000000000000000000000",
  "verification": "verified",
  "verified_at": "2026-10-27T07:00:01Z",
  "verifier_version": "0.1.0-design"
}
